{
  "$schema": "https://json-schema.org/draft/2020-12/schema",
  "$id": "urn:szk:contract:ma.run:1",
  "$comment": "a tervből (próza) — pontosítandó",
  "title": "szk.ma.run/v1 — futás-leíró (run.json; analyze --json-summary; terv 4.5)",
  "type": "object",
  "required": [
    "schema",
    "run_id",
    "mode",
    "spec",
    "equivalent_argv",
    "engine_version",
    "data",
    "k",
    "primary",
    "validation_summary"
  ],
  "properties": {
    "schema": {
      "const": "szk.ma.run/v1"
    },
    "run_id": {
      "type": [
        "string",
        "null"
      ],
      "pattern": "^\\d{8}T\\d{6}Z-[0-9a-f]{6}$",
      "description": "commit-futásnál UTC időbélyeg + az adat-sha256 első 6 jegye; explore-futásnál null"
    },
    "mode": {
      "enum": [
        "explore",
        "commit"
      ]
    },
    "spec": {
      "type": "object",
      "required": [
        "path",
        "sha256",
        "name",
        "parent"
      ],
      "properties": {
        "path": {
          "type": [
            "string",
            "null"
          ],
          "description": "projekt-relatív út (a projekten kívül abszolút)"
        },
        "sha256": {
          "type": [
            "string",
            "null"
          ],
          "pattern": "^[0-9a-f]{64}$"
        },
        "name": {
          "type": [
            "string",
            "null"
          ]
        },
        "parent": {
          "type": [
            "string",
            "null"
          ]
        }
      }
    },
    "equivalent_argv": {
      "type": [
        "array",
        "null"
      ],
      "items": {
        "type": "string"
      },
      "description": "egyenértékű parancssor (ma.py analyze --spec … --out …)"
    },
    "engine_version": {
      "type": "string"
    },
    "data": {
      "type": "object",
      "required": [
        "path",
        "sha256",
        "rows"
      ],
      "properties": {
        "path": {
          "type": [
            "string",
            "null"
          ]
        },
        "sha256": {
          "type": [
            "string",
            "null"
          ],
          "pattern": "^[0-9a-f]{64}$"
        },
        "rows": {
          "type": [
            "integer",
            "null"
          ],
          "minimum": 0
        }
      }
    },
    "files": {
      "type": "object",
      "description": "szerep (results, plot, report, …) → kimeneti fájl; explore-futásnál nincs",
      "additionalProperties": {
        "type": "object",
        "required": [
          "path",
          "sha256"
        ],
        "properties": {
          "path": {
            "type": "string"
          },
          "sha256": {
            "$ref": "urn:szk:contract:common:1#/$defs/sha256"
          }
        }
      }
    },
    "k": {
      "type": [
        "integer",
        "null"
      ],
      "minimum": 0
    },
    "primary": {
      "type": [
        "object",
        "null"
      ],
      "required": [
        "model",
        "display_text"
      ],
      "properties": {
        "model": {
          "type": [
            "string",
            "null"
          ]
        },
        "display_text": {
          "$ref": "urn:szk:contract:common:1#/$defs/i18n"
        }
      }
    },
    "validation_summary": {
      "type": "object",
      "required": [
        "error",
        "warning",
        "info"
      ],
      "properties": {
        "error": {
          "type": "integer",
          "minimum": 0
        },
        "warning": {
          "type": "integer",
          "minimum": 0
        },
        "info": {
          "type": "integer",
          "minimum": 0
        }
      }
    },
    "client_seq": {
      "type": "integer"
    },
    "elapsed_ms": {
      "type": "integer",
      "minimum": 0
    },
    "started": {
      "type": "string",
      "pattern": "^\\d{4}-\\d{2}-\\d{2}T\\d{2}:\\d{2}:\\d{2}(?:\\.\\d{1,6})?Z$"
    },
    "finished": {
      "type": "string",
      "pattern": "^\\d{4}-\\d{2}-\\d{2}T\\d{2}:\\d{2}:\\d{2}(?:\\.\\d{1,6})?Z$"
    }
  }
}
