{
  "schema": "szk.ma.run/v1",
  "run_id": null,
  "mode": "explore",
  "spec": {
    "path": null,
    "sha256": null,
    "name": "o1_primary",
    "parent": null
  },
  "equivalent_argv": null,
  "engine_version": "0.2.0",
  "data": {
    "path": "03_adatok/o1.csv",
    "sha256": "9f3a000000000000000000000000000000000000000000000000000000000000",
    "rows": 13
  },
  "k": 12,
  "primary": {
    "model": "random",
    "display_text": {
      "hu": "0,49 [0,33; 0,73]",
      "en": "0.49 [0.33; 0.73]"
    }
  },
  "validation_summary": {
    "error": 1,
    "warning": 0,
    "info": 2
  },
  "client_seq": 58,
  "elapsed_ms": 41
}
